A person performs a punch with their right hand. 	 a person performs a punch with their right hand
Person boxing with right hand 	 person boxing with right hand
A person punches. 	 a person punches
The human performs a right-handed punch. 	 the human performs a right handed punch
someone makes a step forward with his right foot by boxing with his right hand 	 someone makes a step forward with his right foot by boxing with his right hand
Someone is doing a high punch with his right fist. 	 someone is doing a high punch with his right fist
A person punches in the air in front of him with his right arm 	 a person punches in the air in front of him with his right arm
a person punches something with its right hand 	 a person punches something with its right hand
A person performs a jab with his right hand. 	 a person performs a jab with his right hand
A person is punching with his right hand. 	 a person is punching with his right hand
Subject kicking someone with its left foot. 	 subject kicking someone with its left foot
A human performs a sidekick with the left foot, moving up its hands in defence position 	 a human performs a sidekick with the left foot moving up its hands in defence position
a person kicks something with its left foot 	 a person kicks something with its left foot
A person kneels down on hands an feet. 	 a person kneels down on hands an feet
A person gets on all fours, ready to crawl. 	 a person gets on all fours ready to crawl
A person goes down to his knees. 	 a person goes down to his knees
A human goes down on all fours 	 a human goes down on all fours
A person walks a right curve 	 a person walks a right curve
A person walks in a quarter circle 	 a person walks in a quarter circle
A person goes slowly 5 steps forward. 	 a person goes slowly 5 steps forward
A person walks slowly forward. 	 a person walks slowly forward
A person slowly walks 4 steps forwards. 	 a person slowly walks 4 steps forwards
A person walks forward 4 steps. 	 a person walks forward 4 steps
A persons walks five steps forward 	 a persons walks 5 steps forward
A person walks forwards, turns and walks back. 	 a person walks forwards turns and walks back
a person walks forwards a few steps then turns 180 degrees to the right and keeps walking 	 a person walks forwards a few steps then turns 180 degrees to the right and keeps walking
Person going an all fours and then crawling forwards 	 person going an all fours and then crawling forwards
human kneels down and then crawls 	 human kneels down and then crawls
A person is crawling. 	 a person is crawling
A person gets in their knees and crawls 3 steps. 	 a person gets in their knees and crawls 3 steps
a person goes down on its knees and crawls 	 a person goes down on its knees and crawls
A person is crawling 	 a person is crawling
A person steps forwards then turns around and steps forwards again. 	 a person steps forwards then turns around and steps forwards again
A person goes forward, turns around and goes back. 	 a person goes forward turns around and goes back
a person walks forwards a few steps and then turn 180 degrees to the right and then walks back some meters 	 a person walks forwards a few steps and then turn 180 degrees to the right and then walks back some meters
A person is running forward. 	 a person is running forward
A person throws an object with the left hand. 	 a person throws an object with the left hand
A human plays golf with a careful movement. 	 a human plays golf with a careful movement
Someone gets pushed backwards. 	 someone gets pushed backwards
A person gets pushed from the front a few meters back 	 a person gets pushed from the front a few m back
picking up something from the ground in the front 	 picking up something from the ground in the front
A person turns 180° to the right very fast. 	 a person turns 180 degrees to the right very fast
a person walks forward turns 180 degrees to the right and keeps on walking 	 a person walks forward turns 180 degrees to the right and keeps on walking
A person does a few steps and turns on his rigth foot. 	 a person does a few steps and turns on his right foot
A person goes five steps forward. 	 a person goes 5 steps forward
A person lifts their arms for a moment and then sits down on the floor. 	 a person lifts their arms for a moment and then sits down on the floor
Someone raises his arms to the side and then gets down on his knees. 	 someone raises his arms to the side and then gets down on his knees
A person walking slowly forwards. 	 a person walking slowly forwards
A person walks 4 steps forward. 	 a person walks 4 steps forward
A person moves three and a half steps forward, goes back and moves forward again. 	 a person moves 3 and a half steps forward goes back and moves forward again
A person takes four forward steps, than two bakcward steps and finally four forward steps again. 	 a person takes 4 forward steps than 2 backward steps and finally 4 forward steps again
a person walks forwards gets pushed back and keeps on walking forwards 	 a person walks forwards gets pushed back and keeps on walking forwards
A person walks forward, then gets pushed back a little but continues walking forward in a straight line afterwards. 	 a person walks forward then gets pushed back a little but continues walking forward in a straight line afterwards
A person is getting on his knees. 	 a person is getting on his knees
a human goes down on his knees 	 a human goes down on his knees
A person walks a quarter of a circle counterclockwise. 	 a person walks a quarter of a circle counterclockwise
a human walks a quarter to the left 	 a human walks a quarter to the left
human runs for about five steps starting with right foot 	 human runs for about 5 steps starting with right foot
Somebody runs straight on. 	 somebody runs straight on
A human playing a violin 	 a human playing a violin
A person is flexing their biceps. 	 a person is flexing their biceps
A person holds an object with his right hand and wipes it with its left hand. 	 a person holds an object with his right hand and wipes it with its left hand
a person plays the violin with its left hand 	 a person plays the violin with its left hand
A man is playing an instrument 	 a man is playing an instrument
A person accelerates forward and then slows down again 	 a person accelerates forward and then slows down again
A person walks forward. 	 a person walks forward
a person running energetically and brakes abruptly. 	 a person running energetically and brakes abruptly
The human is running 	 the human is running
the person is first walking and then making a sharp left turn 	 the person is first walking and then making a sharp left turn
A person walks forward and turns to the left. 	 a person walks forward and turns to the left
A person walks a quarter ciricle to the left, taking five steps. 	 a person walks a quarter circle to the left taking 5 steps
A human walking in a circle clockwise 	 a human walking in a circle clockwise
A person is walking in a circle clockwise. 	 a person is walking in a circle clockwise
A human goes around the circle clockwise 	 a human goes around the circle clockwise
someone walks a larger clockwise. 	 someone walks a larger clockwise
a person walks in a circle to the right 	 a person walks in a circle to the right
A person walks to the right and then to the left with lateral steps. 	 a person walks to the right and then to the left with lateral steps
walking counter clock-wise in a circle 	 walking counter clock wise in a circle
A person walks in a circle round an axis. 	 a person walks in a circle round an axis
A person walks a circle. 	 a person walks a circle
A person do a 360 degree twist. 	 a person do a 360 degrees twist
A person jumps forward while turning 90 degrees to the left. 	 a person jumps forward while turning 90 degrees to the left
Someone walks a full clockwise circle 	 someone walks a full clockwise circle
a person is walking in a circle in clockwise direction. 	 a person is walking in a circle in clockwise direction
A person performs a high kick while turning. 	 a person performs a high kick while turning
A human performs a 90° counter clockwise jump. 	 a human performs a 90 degrees counter clockwise jump
A person is walking up to sit on something, sits there for a short while and then stands up again and walks away. 	 a person is walking up to sit on something sits there for a short while and then stands up again and walks away
A person walks forward 	 a person walks forward
A person walks four straight steps forward. 	 a person walks 4 straight steps forward
Somebody walks slowly straight on. 	 somebody walks slowly straight on
A person first walks, then crawls on all fours and then walks again. 	 a person first walks then crawls on all fours and then walks again
Someone jumps to the left. 	 someone jumps to the left
A human performs a jump to the left. 	 a human performs a jump to the left
A person jumps to his left. 	 a person jumps to his left
Person walking in a curve to the left 	 person walking in a curve to the left
human goes forward in a quater circle conterclockwise starting with left 	 human goes forward in a quarter circle counterclockwise starting with left
A human performs a tight 90° left curve 	 a human performs a tight 90 degrees left curve
a person walks a quater circle to the left 	 a person walks a quarter circle to the left
A person taking a 90 degree left turn 	 a person taking a 90 degrees left turn
A person walks 4 steps forward. 	 a person walks 4 steps forward
A human walking forward 	 a human walking forward
A person is turning multiple wheels. 	 a person is turning multiple wheels
A person first waves his left hand then widely both hands. 	 a person first waves his left hand then widely both hands
A person is balancing forward with both arms stretched out to the side. 	 a person is balancing forward with both arms stretched out to the side
A person looks around and then walks forward. 	 a person looks around and then walks forward
a person waves with both of his hands 	 a person waves with both of his hands
the person is doing boxing 	 the person is doing boxing
A person hits something with its right arm 	 a person hits something with its right arm
A human boxes with its right hand once. 	 a human boxes with its right hand once
a person walks forward 	 a person walks forward
human goes forward 	 human goes forward
A person runs 	 a person runs
Someone is trying to walk fast 4 steps starting with the right leg and then stopping. 	 someone is trying to walk fast 4 steps starting with the right leg and then stopping
a persone wipe a surface 	 a person wipe a surface
A person is stirring with their right hand. 	 a person is stirring with their right hand
A human performs a whiping movement with the right hand 	 a human performs a whining movement with the right hand
a person wipes a plane with its right hand 	 a person wipes a plane with its right hand
A person wipes  a surface with his right hand. 	 a person wipes a surface with his right hand
A person stirring with their right hand 	 a person stirring with their right hand
Someone moves his right hand in a circular motion in front of his upper body. 	 someone moves his right hand in a circular motion in front of his upper body
a man is wiping something with his right hand 	 a man is wiping something with his right hand
A person slowly walking forwards for a few steps 	 a person slowly walking forwards for a few steps
The human walks very slowly 	 the human walks very slowly
A person jumps over an obstacle  while moving forward. 	 a person jumps over an obstacle while moving forward
human takes a swing like while playing golf 	 human takes a swing like while playing golf
A person playing golf over his right shoulder. 	 a person playing golf over his right shoulder
a person plays golf with its right hand 	 a person plays golf with its right hand
A human performs a hard hit with a golf club and swings the club over its shoulder while doing the hit. 	 a human performs a hard hit with a golf club and swings the club over its shoulder while doing the hit
A person is playing golf. 	 a person is playing golf
A person performs a golf swing. 	 a person performs a golf swing
A person runs forwards and turns around. 	 a person runs forwards and turns around
A person walks a quarter circle clockwise. 	 a person walks a quarter circle clockwise
a person walks 	 a person walks
A person is walking forward. 	 a person is walking forward
A person takes a deep bow. 	 a person takes a deep bow
A person bows. 	 a person bows
a person takes a deep bow 	 a person takes a deep bow
A person walks forward during that the person is pushed slightly to the left. 	 a person walks forward during that the person is pushed slightly to the left
A human performs a handspring. 	 a human performs a handspring
A person walks forward at medium speed. 	 a person walks forward at medium speed
A person walks 2 steps forward, turns 180 degrees on the left foot and walks again 2 steps forward. 	 a person walks 2 steps forward turns 180 degrees on the left foot and walks again 2 steps forward
The human walks a left bend. 	 the human walks a left bend
A person gets down to the knees. 	 a person gets down to the knees
A person sneaking while crouched. 	 a person sneaking while crouched
A person makes a far jump. 	 a person makes a far jump
A person stumbling to the right. 	 a person stumbling to the right
A person walks in a clockwise circle 	 a person walks in a clockwise circle
A person running in a full circle, clockwise. 	 a person running in a full circle clockwise
Someone moves forward in a jog. 	 someone moves forward in a jog
A human starts jogging, moving up its hands and stopping the jogging movement 	 a human starts jogging moving up its hands and stopping the jogging movement
a person jogs for some meters 	 a person jogs for some meters
A Person jogs a few steps. 	 a person jogs a few steps
A person walking forwards, turning on the right foot and walking back again 	 a person walking forwards turning on the right foot and walking back again
A person is spinning around while walking. 	 a person is spinning around while walking
A person walks around a corner to their right. 	 a person walks around a corner to their right
Someone walks a right turn 	 someone walks a right turn
A person walks a 90° curve, its head hanging down 	 a person walks a 90 degrees curve its head hanging down
Subject kneels down. 	 subject kneels down
a person makes a T-pose and kneels down 	 a person makes a T-pose and kneels down
a person kneels down 	 a person kneels down
A person is fishing. 	 a person is fishing
A person jumping and then walking four steps. 	 a person jumping and then walking 4 steps
The jump performs a counter-clockwise jump. 	 the jump performs a counter clockwise jump
Someone is stirring with his right hand. 	 someone is stirring with his right hand
A person wipes a desk. 	 a person wipes a desk
A kneeling person raises their arms to the sides and stands up. 	 a kneeling person raises their arms to the sides and stands up
kneeling person stands up. 	 kneeling person stands up
The human stands up 	 the human stands up
a person walks forwards 	 a person walks forwards
A person walks 2 steps forward, turns 180 degrees on the left foot and walks again 2 steps forward. 	 a person walks 2 steps forward turns 180 degrees on the left foot and walks again 2 steps forward
a human walks forward forming a lying eight 	 a human walks forward forming a lying 8
A person walks clockwise in a circle. 	 a person walks clockwise in a circle
A person changes suddenly the direction and then runs to the left. 	 a person changes suddenly the direction and then runs to the left
A human walks up stairs. 	 a human walks up stairs
A human walks forward. 	 a human walks forward
Someone gets pushed from the front. 	 someone gets pushed from the front
a person gets pushed from the front and stumbles back a few steps 	 a person gets pushed from the front and stumbles back a few steps
A person acting like a chicken. 	 a person acting like a chicken
A person waves forward with the left hand. 	 a person waves forward with the left hand
A human waves with its left hand. 	 a human waves with its left hand
Subject walks a quarter circle clockwise. 	 subject walks a quarter circle clockwise
A person walks in a 90° curve to his right. 	 a person walks in a 90 degrees curve to his right
A person waits on a ATM line and then goes to the machine. 	 a person waits on a atm line and then goes to the machine
a human sit 	 a human sit
A person is skateboarding. 	 a person is skateboarding
A person walks slowly 4 steps forward. 	 a person walks slowly 4 steps forward
A person is running forward. 	 a person is running forward
A person walks backward at a slow speed. 	 a person walks backward at a slow speed
A human is walking 4 steps backwards and starting with its left food. 	 a human is walking 4 steps backwards and starting with its left food
A person walks backwards. 	 a person walks backwards
some is reverse walking 	 some is reverse walking
A person takes 4 steps backwards. 	 a person takes 4 steps backwards
A person moves backwards 4 steps before standing still 	 a person moves backwards 4 steps before standing still
Someone is walking backwards. 	 someone is walking backwards
a man is walking backwards 	 a man is walking backwards
Somebody walks a few steps backward. 	 somebody walks a few steps backward
A person moves both hands in circles in front of its body. 	 a person moves both hands in circles in front of its body
A person is shaking arms and legs like doing a warming up. 	 a person is shaking arms and legs like doing a warming up
Someone walks a clockwise circle 	 someone walks a clockwise circle
a person is walking a clockwise circle 	 a person is walking a clockwise circle
A person walks in a circle. 	 a person walks in a circle
A human is walking in circle to the right 	 a human is walking in circle to the right
A person stands and begins walking slowly forward to stop again after a few steps. 	 a person stands and begins walking slowly forward to stop again after a few steps
human slowly goes forward starting with right 	 human slowly goes forward starting with right
A human walks slowly 4 steps forward. 	 a human walks slowly 4 steps forward
A person is walking. 	 a person is walking
A human walks forward and goes up the stairs. 	 a human walks forward and goes up the stairs
Person stumbles forward. 	 person stumbles forward
A person stumbles forward. 	 a person stumbles forward
A human steps down a low platform. 	 a human steps down a low platform
A person walks fast forward. 	 a person walks fast forward
A person walks up a hill. 	 a person walks up a hill
A person is dancing some Latin or Standard dance. 	 a person is dancing some latin or standard dance
A person walks 4 steps forward. 	 a person walks 4 steps forward
The human walks slowly 	 the human walks slowly
human goes forward 	 human goes forward
a person takes 5 steps forward 	 a person takes 5 steps forward
Someone walks forward. 	 someone walks forward
A person jumps forward. 	 a person jumps forward
A person plays the air violin 	 a person plays the air violin
The human is playing violin 	 the human is playing violin
A person walks in a circle counter clockwise. 	 a person walks in a circle counter clockwise
A person is touching the floor with the right hand. 	 a person is touching the floor with the right hand
A person walks 4 steps forward. 	 a person walks 4 steps forward
Someone cleans a table. 	 someone cleans a table
a persons wipes something with its right hand 	 a persons wipes something with its right hand
A human is performing a horizontal whiping movement with the right hand 	 a human is performing a horizontal whining movement with the right hand
A person is wiping with the right hand. 	 a person is wiping with the right hand
A person goes left. 	 a person goes left
a person walks to the left 	 a person walks to the left
A person walks four fast steps forward. 	 a person walks 4 fast steps forward
the person makes only one step 	 the person makes only 1 step
a person takes one step forwards 	 a person takes 1 step forwards
A person is pushed forwards. 	 a person is pushed forwards
A human drinks. 	 a human drinks
A human walks to the left. 	 a human walks to the left
Someone is walking forward and then performing a left turn. 	 someone is walking forward and then performing a left turn
A human is walking a quarter of a cirlce to its left. 	 a human is walking a quarter of a circle to its left
Person stands up from a kneeing position. 	 person stands up from a kneeing position
a person stands up from the ground 	 a person stands up from the ground
Subject walks in a full circle counterclockwise. 	 subject walks in a full circle counterclockwise
A human being pushed 	 a human being pushed
The human perfoms a step backwards 	 the human performs a step backwards
A person is making a sidestep to the right. 	 a person is making a sidestep to the right
A person is slowly walking backwards. 	 a person is slowly walking backwards
A person walking forwards and upwards 	 a person walking forwards and upwards
a person climbs some stairs 	 a person climbs some stairs
A person is walking up stairs. 	 a person is walking up stairs
A person walks forward, turns around on the spot and walks back 	 a person walks forward turns around on the spot and walks back
human goes forward, turns around partway, and goes back to the starting point 	 human goes forward turns around partway and goes back to the starting point
a person walks forwards a few step the turn 180 degrees to the left and keeps walking 	 a person walks forwards a few step the turn 180 degrees to the left and keeps walking
a human plays guitar. 	 a human plays guitar
A person plays the guitar. 	 a person plays the guitar
a person plays the guitar with its right hand 	 a person plays the guitar with its right hand
A person makes guitar playing motions 	 a person makes guitar playing motions
Someone plays guitar with his right hand. 	 someone plays guitar with his right hand
Someone is beating something 	 someone is beating something
A person walks forward, stops briefly, goes one step back and then continuos walking forward. 	 a person walks forward stops briefly goes 1 step back and then continuously walking forward
a person walks forwards gets pushed back and walks forwards again 	 a person walks forwards gets pushed back and walks forwards again
a person walks forwards, stumbles against something and then walks forward again. 	 a person walks forwards stumbles against something and then walks forward again
A human runs and stops. 	 a human runs and stops
human goes in a quarter circle counterclockwise starting with left 	 human goes in a quarter circle counterclockwise starting with left
Someone walks a quarter-circle to the right. 	 someone walks a quarter circle to the right
Someone walks a right turn 	 someone walks a right turn
A human performs a 90° curve tu the right 	 a human performs a 90 degrees curve tu the right
A human walks a quarter to his right 	 a human walks a quarter to his right
A person turns right. 	 a person turns right
A person walks forward, turns on the spot and walks back. 	 a person walks forward turns on the spot and walks back
A person takes a shower. 	 a person takes a shower
Someone wiggles his upper body while standing. 	 someone wiggles his upper body while standing
A person swims butterfly. 	 a person swims butterfly
A person turns right. 	 a person turns right
A person walks a circle clockwise. 	 a person walks a circle clockwise
A person walks in an quarter circle. 	 a person walks in an quarter circle
A human walks a quarter of a circle to its right. 	 a human walks a quarter of a circle to its right
A man keep down and lateralyl move 	 a man keep down and laterally move
A person stands up from a kneeling position. 	 a person stands up from a kneeling position
a person stands up from the ground 	 a person stands up from the ground
a person walks forward and gets pushed from the back 	 a person walks forward and gets pushed from the back
A person is pushed from the right. 	 a person is pushed from the right
Person walking and turning on one foot 	 person walking and turning on 1 foot
Someone walks, turns around and walks back 	 someone walks turns around and walks back
a person walks forwards then turn right 180 degrees and keeps walking 	 a person walks forwards then turn right 180 degrees and keeps walking
A person turns 180 degrees on his right foot. 	 a person turns 180 degrees on his right foot
A human impersonates a chicken flapping its wings. 	 a human impersonates a chicken flapping its wings
Someone imitates a chicken 	 someone imitates a chicken
A human is wagging its arms like a chicken 	 a human is wagging its arms like a chicken
A person moves his hands to his chest and moves his elbows up and down several times. 	 a person moves his hands to his chest and moves his elbows up and down several times
a person does the chicken moves 	 a person does the chicken moves
human performs a chicken dance 	 human performs a chicken dance
A person squats while doing a chicken wing motion with his arms. 	 a person squats while doing a chicken wing motion with his arms
A person is dancing 	 a person is dancing
A human turning left 	 a human turning left
A human performs gestures displaying frustration. 	 a human performs gestures displaying frustration
A peron walks in a quarter circle. 	 a peron walks in a quarter circle
Someone is walking forward and then coming to a stop while turning to the right. 	 someone is walking forward and then coming to a stop while turning to the right
A person walks forward before turing 80° to his right. 	 a person walks forward before turing 80 degrees to his right
