A person kneels down on the floor, using both hand as support. 	 a person kneels down on the floor using both hand as support
A person makes a step to the left. 	 a person makes a step to the left
a man has been pushed to the left 	 a man has been pushed to the left
A person is sitting on a chair and than getting up from the chair. 	 a person is sitting on a chair and than getting up from the chair
A human makes a left turn. 	 a human makes a left turn
A person goes left around a corner 	 a person goes left around a corner
Someone walks forward. 	 someone walks forward
A person walking forwards. 	 a person walking forwards
A person walked away. 	 a person walked away
A person walks in a weird form 	 a person walks in a weird form
A human is walking 4 steps forward, starting with its right food. 	 a human is walking 4 steps forward starting with its right food
a person walks forwards 	 a person walks forwards
A person steps to the left with his left foot then crosses behind with his right foot before returning to the starting position. 	 a person steps to the left with his left foot then crosses behind with his right foot before returning to the starting position
A person gets pushed from the right and performs a recovery step to the behind left side. 	 a person gets pushed from the right and performs a recovery step to the behind left side
A person dodges backwards to the left 	 a person dodges backwards to the left
A person dodges sidewards. 	 a person dodges sideward
A person starts jogging. 	 a person starts jogging
a person jogs forwards 	 a person jogs forwards
A human walking. 	 a human walking
A person moves straight forward. 	 a person moves straight forward
Someone is walking forward 4 steps starting with the right leg. 	 someone is walking forward 4 steps starting with the right leg
A person walks 4 steps forward. 	 a person walks 4 steps forward
A person slowly walks forward. 	 a person slowly walks forward
A person is walking forward 	 a person is walking forward
A person is pushed forward. 	 a person is pushed forward
the person is walking in a half circle shape to the right 	 the person is walking in a half circle shape to the right
A person turns right. 	 a person turns right
Subject is stepping akwardly. 	 subject is stepping awkwardly
A person walks over step stones. 	 a person walks over step stones
A human takes a few steps forward very carefully, watching where he puts his feet. 	 a human takes a few steps forward very carefully watching where he puts his feet
a person moves forward on some objects 	 a person moves forward on some objects
A person is balancing over an obejct. 	 a person is balancing over an object
A human performs one large step forwards and rightwards. 	 a human performs 1 large step forwards and rightward
A human is performing a cartwheel. 	 a human is performing a cartwheel
A person does a cartwheel. 	 a person does a cartwheel
A person walks forward and turns to the left. 	 a person walks forward and turns to the left
Somebody walks a quarter circle anticlockwise. 	 somebody walks a quarter circle anticlockwise
Person walking to the left 	 person walking to the left
human goes in a quater circle counterclockwise starting with left 	 human goes in a quarter circle counterclockwise starting with left
A person walks backwards in a straight line slightly swinging his arms by his sides as he does so. 	 a person walks backwards in a straight line slightly swinging his arms by his sides as he does so
Someone walks backward 	 someone walks backward
A human walks 4 steps backwards on one line. 	 a human walks 4 steps backwards on 1 line
Athlet jumping on a horizontal bar, actively swinging back and forth 3 times 	 athlete jumping on a horizontal bar actively swinging back and forth 3 times
A human turns abruptly. 	 a human turns abruptly
A person walks two steps forward, performs a spot turn on the left foot and walks back to the start position. 	 a person walks 2 steps forward performs a spot turn on the left foot and walks back to the start position
A person turns on his right foot. 	 a person turns on his right foot
a person walks forward takes a 180 degree turn to the right and walks some more steps 	 a person walks forward takes a 180 degrees turn to the right and walks some more steps
A person is bending a bit forward and then jumping and running a bit. 	 a person is bending a bit forward and then jumping and running a bit
Someone walks three steps in curve to the right 	 someone walks 3 steps in curve to the right
A person walks a small half circle. 	 a person walks a small half circle
Somebody walks a quarter circle in clockwise direction 	 somebody walks a quarter circle in clockwise direction
Person walking in a circle to the left 	 person walking in a circle to the left
A person walks in a counter-clockwise circle 	 a person walks in a counter clockwise circle
a person walks in a circle to the left 	 a person walks in a circle to the left
Someone walks in a circle to the right. 	 someone walks in a circle to the right
A person walks forward. 	 a person walks forward
A person walks five steps forward. 	 a person walks 5 steps forward
A person walks a circle clockwise. 	 a person walks a circle clockwise
A person waves twice with their right arm. 	 a person waves twice with their right arm
Someone waves with the right hand 	 someone waves with the right hand
a person wipes something with its right hand horizontally 	 a person wipes something with its right hand horizontally
a human is wawving with his right hand 	 a human is waving with his right hand
A human walking forwards 	 a human walking forwards
a person walks slowly forward 	 a person walks slowly forward
A person is walking forward slowly. 	 a person is walking forward slowly
A person walking forwards, then turning on the right foot and walking back again. 	 a person walking forwards then turning on the right foot and walking back again
A person makes a step forward and then performs a high kick with their right leg. 	 a person makes a step forward and then performs a high kick with their right leg
a person performs a push kick with his right foot 	 a person performs a push kick with his right foot
Subject walks forward is pushed backwards and then walks forward again. 	 subject walks forward is pushed backwards and then walks forward again
A person gets pushed away. 	 a person gets pushed away
A person walks down a slope and then climbs some stairs. 	 a person walks down a slope and then climbs some stairs
A human stretches with the arms over her head. 	 a human stretches with the arms over her head
A person is waving the right hand. 	 a person is waving the right hand
While walking, a human is pushed from the right side. 	 while walking a human is pushed from the right side
a person walks forward and gets pushed to the left 	 a person walks forward and gets pushed to the left
a person is pushed to the left while walking. 	 a person is pushed to the left while walking
a person sprints and stops 	 a person sprints and stops
A person walking fast forward. 	 a person walking fast forward
a person walks forward quite fast 	 a person walks forward quite fast
A Person moves in a slow walk 	 a person moves in a slow walk
A person moves forward some meters and stops to stand still. 	 a person moves forward some m and stops to stand still
A persons wipes in circles 	 a persons wipes in circles
the person is doing a circular motion with the right hand 	 the person is doing a circular motion with the right hand
A person moves his right hand horizontally and clockwise in front of his belly. 	 a person moves his right hand horizontally and clockwise in front of his belly
a person wipes something with its right hand 	 a person wipes something with its right hand
A person is wiping with his right arm. 	 a person is wiping with his right arm
The human points to something using his right hand 	 the human points to something using his right hand
A human steps over a small obstacle. 	 a human steps over a small obstacle
A person picks up a heavy object from the ground and puts it down on the floor again. 	 a person picks up a heavy object from the ground and puts it down on the floor again
a person walks over a gap 	 a person walks over a gap
A kneeling person is standing up. 	 a kneeling person is standing up
A human balances while walking forwards. 	 a human balances while walking forwards
A person bends down then keeps moving the head to look around. 	 a person bends down then keeps moving the head to look around
Someone who describes something. 	 someone who describes something
Someone walking forward and curving to the left 	 someone walking forward and curving to the left
A person walks forward very slowly 	 a person walks forward very slowly
Someone walks forward 	 someone walks forward
A person is slowly walking forward. 	 a person is slowly walking forward
A persons takes five very slow steps 	 a persons takes 5 very slow steps
a human walks forward 	 a human walks forward
A human walks four steps. 	 a human walks 4 steps
A person interacts with something using the left hand. 	 a person interacts with something using the left hand
Person doing a handstand 	 person doing a handstand
A person performs a handstand 	 a person performs a handstand
someone makes a handstand. 	 someone makes a handstand
a human goes into a handstand position, and comes back on his feet. 	 a human goes into a handstand position and comes back on his feet
Someone does a handstand. 	 someone does a handstand
a person stands and then walks a few steps forward 	 a person stands and then walks a few steps forward
A person makes two steps forward, stumbles and continues to move forward. 	 a person makes 2 steps forward stumbles and continues to move forward
A person stumbles forward. 	 a person stumbles forward
the person is playing violin 	 the person is playing violin
a person plays the violin with its right hand 	 a person plays the violin with its right hand
Person stumbling after standing 	 person stumbling after standing
A person is pushed to the left. 	 a person is pushed to the left
A human is doing a sidestep to the left, returning to the initial position 	 a human is doing a sidestep to the left returning to the initial position
A person is pushed to the left. 	 a person is pushed to the left
A human walks in a quarter circle. 	 a human walks in a quarter circle
During walking forward a person is hit in the back. 	 during walking forward a person is hit in the back
A human walks 2 steps forwards and then trips down  one stair. 	 a human walks 2 steps forwards and then trips down 1 stair
a person walks forward and gets pushed from behind 	 a person walks forward and gets pushed from behind
A person walks and stops immediately. 	 a person walks and stops immediately
A person jumps in the air and then walks 4 steps in the forward direction. 	 a person jumps in the air and then walks 4 steps in the forward direction
A person walks forward then tu rns around by his left side and walks forward again. 	 a person walks forward then turns around by his left side and walks forward again
A person walks two steps forward, turns around and walks back to the starting point. 	 a person walks 2 steps forward turns around and walks back to the starting point
Someone swings their hip while dancing 	 someone swings their hip while dancing
someone is warming up 	 someone is warming up
Someone walks forward. 	 someone walks forward
A person walks forward at a normal pace 	 a person walks forward at a normal pace
human goes forward 	 human goes forward
A person walking five steps forward 	 a person walking 5 steps forward
A person walks forward 	 a person walks forward
A person walks 4 steps forward. 	 a person walks 4 steps forward
A person walks 4 steps. 	 a person walks 4 steps
A person walks forward 	 a person walks forward
The human walks forwards. 	 the human walks forwards
Someone walks forward 4 steps starting with the right leg. 	 someone walks forward 4 steps starting with the right leg
A person raises their left arm and swings it down. 	 a person raises their left arm and swings it down
A human throws something on the ground with his left hand 	 a human throws something on the ground with his left hand
a person throws something on the ground in front of it with its left hand 	 a person throws something on the ground in front of it with its left hand
human throws something 	 human throws something
A person throws something with the left hand 	 a person throws something with the left hand
A human stepping to the side 	 a human stepping to the side
A person stands still and is pushed slightly to the right. 	 a person stands still and is pushed slightly to the right
Somebody goes a step to the right. 	 somebody goes a step to the right
A human looking to the left and then walking forwards 	 a human looking to the left and then walking forwards
A person walks forwards. 	 a person walks forwards
A person walks. 	 a person walks
A human jumps up with a 270 degree turnaround into the left. 	 a human jumps up with a 270 degrees turnaround into the left
a person walks slowly. 	 a person walks slowly
A person walks while accelerating at first and slows down again after a couple of steps 	 a person walks while accelerating at first and slows down again after a couple of steps
Subject walks forward with fast steps. 	 subject walks forward with fast steps
A human walks forward a few steps in a fast pace 	 a human walks forward a few steps in a fast pace
A person walks straight forward quite fast 	 a person walks straight forward quite fast
a person takes a few fast steps forward 	 a person takes a few fast steps forward
A person walks a sharp turn to the left. 	 a person walks a sharp turn to the left
A person doing a 360 degree jump on the same place. 	 a person doing a 360 degrees jump on the same place
A person walks 4 steps forward. 	 a person walks 4 steps forward
A human walks forwards 	 a human walks forwards
a person is walking fast forward 	 a person is walking fast forward
A person walks fast. 	 a person walks fast
A person walks five steps forward, knees slightly bend 	 a person walks 5 steps forward knees slightly bend
A person walks forwards. 	 a person walks forwards
A person is carefully making a step to the right. 	 a person is carefully making a step to the right
A person jumps to the left, jumping off and landing with two feet. 	 a person jumps to the left jumping off and landing with 2 feet
Someone jumps to the left with both feed 	 someone jumps to the left with both feed
Someone is jumping to the left side with both legs simultaneously. 	 someone is jumping to the left side with both legs simultaneously
a person jumps about 30cm to the left 	 a person jumps about 30 centimeters to the left
A person jumps to the left side. 	 a person jumps to the left side
A person walks a distance of a quarter of a circle to the right. 	 a person walks a distance of a quarter of a circle to the right
A person is walking in a curve to the right. 	 a person is walking in a curve to the right
Person stumbling to the left 	 person stumbling to the left
Someone gets pushed from the right then get back to position 	 someone gets pushed from the right then get back to position
a person takes a step to the left and a step to the right again 	 a person takes a step to the left and a step to the right again
A person is holding a sqatted position. 	 a person is holding a squatted position
A human catches a basketball and dribbles with the ball. 	 a human catches a basketball and dribbles with the ball
A person moves two steps forward, turns around and goes back. 	 a person moves 2 steps forward turns around and goes back
A person walks 2 steps forward, then he turns around 180° to his right and walks another 2 steps forward in the opposite direction. 	 a person walks 2 steps forward then he turns around 180 degrees to his right and walks another 2 steps forward in the opposite direction
A person is walking in a slalom. 	 a person is walking in a slalom
A person walks a 90 degree curve to the right. 	 a person walks a 90 degrees curve to the right
A person is walking in a right curve. 	 a person is walking in a right curve
A human walks fast forward. 	 a human walks fast forward
a person walks in a circle to the left 	 a person walks in a circle to the left
A person is walking in a circle counter-clockwise. 	 a person is walking in a circle counter clockwise
a human is walking in circle 	 a human is walking in circle
A person is pushed to the right and makes a few steps to gain balance. 	 a person is pushed to the right and makes a few steps to gain balance
A human steps to the side and walks back to the starting point 	 a human steps to the side and walks back to the starting point
A person walking in a quarter circle to the left. 	 a person walking in a quarter circle to the left
A human stands up from laying flat on the ground face down. 	 a human stands up from laying flat on the ground face down
A person plays violin. 	 a person plays violin
A human performs 5 strokes on a violine 	 a human performs 5 strokes on a violin
a person plays the violin 	 a person plays the violin
A person plays the violin while holding it with his left hand and playing it with his right arm. 	 a person plays the violin while holding it with his left hand and playing it with his right arm
someone wipes a surface with the same height of his neck. 	 someone wipes a surface with the same height of his neck
A person is making circles with his hands in front of his chest. 	 a person is making circles with his hands in front of his chest
A person takes 5 steps forwards dwadling as he does so. 	 a person takes 5 steps forwards dawdling as he does so
human slowly walks forward starting with right 	 human slowly walks forward starting with right
a person walks forwards very slow 	 a person walks forwards very slow
A human walks very slowly 4 steps forward on one line. 	 a human walks very slowly 4 steps forward on 1 line
A person takes 5 steps. 	 a person takes 5 steps
The human perfoms a couple of steps very slowly 	 the human performs a couple of steps very slowly
A person makes slowly four small steps forward. 	 a person makes slowly 4 small steps forward
A person is walking forward very slowly while looking around. 	 a person is walking forward very slowly while looking around
A person walking forwards for a few steps. 	 a person walking forwards for a few steps
a person walks some meters forwards 	 a person walks some m forwards
A person sits on a high chair, walks a bit around and sits again 	 a person sits on a high chair walks a bit around and sits again
A person is walking slightly slouched while drifting to the right. 	 a person is walking slightly slouched while drifting to the right
human seems to be walking on a beam or something similar 	 human seems to be walking on a beam or something similar
A human is moving up a ramp 	 a human is moving up a ramp
A person is walking forward 	 a person is walking forward
A person kicks with the right foot. 	 a person kicks with the right foot
The person holds his posture with bowed legs and bowed arms, like standing at putting his hands on a high table 	 the person holds his posture with bowed legs and bowed arms like standing at putting his hands on a high table
A person walks forward while turning to the right 	 a person walks forward while turning to the right
A person goes forward in a semicircle. 	 a person goes forward in a semicircle
The human perfoms a right turn 	 the human performs a right turn
a person runs and jumps 	 a person runs and jumps
the person is playing a violin 	 the person is playing a violin
the person is moving to the right 	 the person is moving to the right
a person stand still and gets pushed to the right and then takes a step to the left to its original position back 	 a person stand still and gets pushed to the right and then takes a step to the left to its original position back
A person stands still, then makes a step to its right and it looks like it got puched before. 	 a person stands still then makes a step to its right and it looks like it got pushed before
A person does a compensatory movement to the right side. 	 a person does a compensatory movement to the right side
A person does a step the the left side and back. 	 a person does a step the the left side and back
A human jumps forward with both legs. 	 a human jumps forward with both legs
A human walking in a circle counterclockwise 	 a human walking in a circle counterclockwise
Someone is walking a circle to the left. 	 someone is walking a circle to the left
A person doing a drumming movement 	 a person doing a drumming movement
a person performs the an action with its two hands 	 a person performs the an action with its 2 hands
A person turns 180° to the right quickly. 	 a person turns 180 degrees to the right quickly
Someone walks two steps, turns around by 180° to the right and walks two steps. 	 someone walks 2 steps turns around by 180 degrees to the right and walks 2 steps
a person walks forward 	 a person walks forward
A person walks 4 steps forward. 	 a person walks 4 steps forward
a woman is posing 	 a woman is posing
A person bends ts knees. 	 a person bends to knees
A person performs one squat. 	 a person performs 1 squat
A person wipes two times in a circle on a waist high surface. 	 a person wipes 2 times in a circle on a waist high surface
Someone walks forward. 	 someone walks forward
Someone walks forward 	 someone walks forward
A person turns left. 	 a person turns left
A person turns left. 	 a person turns left
A person walks in a counter-clockwise circle. 	 a person walks in a counter clockwise circle
Somebody is walking in a circle. 	 somebody is walking in a circle
Person walking in a circle 	 person walking in a circle
A person is walking in a circle 	 a person is walking in a circle
Someone slowly walks a full circle to the left 	 someone slowly walks a full circle to the left
walking in a slow circle 	 walking in a slow circle
Someone walks a complete circle. 	 someone walks a complete circle
A person turns around to the beginning. 	 a person turns around to the beginning
someone is walking a whole round to his left side 	 someone is walking a whole round to his left side
a person is walking in a circle shape 	 a person is walking in a circle shape
a person walks a circle to the left 	 a person walks a circle to the left
Someone jumps to the right. 	 someone jumps to the right
A person jumps approximately 30 cm to the right with both feet. 	 a person jumps approximately 30 centimeters to the right with both feet
Someone is doing a sidejump to the right. 	 someone is doing a sidejump to the right
A Person is performing a jump with both feet to the right. 	 a person is performing a jump with both feet to the right
A human performs a jump with both feet to its right. 	 a human performs a jump with both feet to its right
A person moves both arms like wings. 	 a person moves both arms like wings
A person walks 4 steps forward. 	 a person walks 4 steps forward
A person takes two steps forward and then two steps to the left. 	 a person takes 2 steps forward and then 2 steps to the left
a person walks to the left performing a quarter circle 	 a person walks to the left performing a quarter circle
A person walks forwards, during that the person is pushed backward, so he makes a few small steps backwards until gaining his balance again and walks on. 	 a person walks forwards during that the person is pushed backward so he makes a few small steps backwards until gaining his balance again and walks on
A person walks forward into an obstacle and recovers. 	 a person walks forward into an obstacle and recovers
While walking forward a person is pushed. 	 while walking forward a person is pushed
a person walks forward and gets pushed to the right 	 a person walks forward and gets pushed to the right
A person walks and makes an compensatory movement to the right side. 	 a person walks and makes an compensatory movement to the right side
a person walks forward and bumps into something to his left. 	 a person walks forward and bumps into something to his left
A person getting shoved from the left while walking forward 	 a person getting shoved from the left while walking forward
human is pushed from its left hand side 	 human is pushed from its left hand side
A person makes four steps forward. 	 a person makes 4 steps forward
A person walks along a straight line forward. 	 a person walks along a straight line forward
The human perfoms a couple of steps 	 the human performs a couple of steps
A person performs some kind of wiping motion. 	 a person performs some kind of wiping motion
A human is making a horizontal wiping motion. 	 a human is making a horizontal wiping motion
A person wipes an object with his left hand. 	 a person wipes an object with his left hand
human goes forward starting with right 	 human goes forward starting with right
A person walks forward. 	 a person walks forward
A person walks slowly forward 	 a person walks slowly forward
A person walks forward and is pushed backwards after a couple of steps. 	 a person walks forward and is pushed backwards after a couple of steps
A person walks against an object. 	 a person walks against an object
an man bumps into something while walking 	 an man bumps into something while walking
a person walks slowly forward 	 a person walks slowly forward
a person wlaks forwards quite slow 	 a person walks forwards quite slow
A person walks 2 steps forward, turns 180 degrees on the left foot and walks again 2 steps forward. 	 a person walks 2 steps forward turns 180 degrees on the left foot and walks again 2 steps forward
The human walks then turn left and walks back to the starting point 	 the human walks then turn left and walks back to the starting point
