A person jumps approximately a meter forward with both feet. 	 a person jumps approximately a m forward with both feet
human walks in a quater circle clockwise 	 human walks in a quarter circle clockwise
A human walks to the left. 	 a human walks to the left
A person is turning slowly to the left. 	 a person is turning slowly to the left
A person turns to the left. 	 a person turns to the left
A human walks a quarter circle to the left 	 a human walks a quarter circle to the left
Somebody walks a quarter circle anticlockwise. 	 somebody walks a quarter circle anticlockwise
A person performs a wiping motion. 	 a person performs a wiping motion
A human is walking into an obstacle, evades it and proceeds walking forward. 	 a human is walking into an obstacle evades it and proceeds walking forward
Someone is being pushed from the front while walking forwards and compensates the disturbance. 	 someone is being pushed from the front while walking forwards and compensates the disturbance
A person walks a few steps forward, then walks a step back and after that he continues walking forward. 	 a person walks a few steps forward then walks a step back and after that he continues walking forward
The human walks a couple of steps forward then perfoms a step backwards and goes back to walk forward 	 the human walks a couple of steps forward then performs a step backwards and goes back to walk forward
a person takes to steps forward, two steps backwards, four steps forward 	 a person takes to steps forward 2 steps backwards 4 steps forward
A human is being pushed. 	 a human is being pushed
A person makes two steps and makes a sitestep. 	 a person makes 2 steps and makes a sidestep
A person is running a little bit tilted first to the right then to the left. 	 a person is running a little bit tilted first to the right then to the left
Person turns around a corner. 	 person turns around a corner
a persons walks forwards to the right 	 a persons walks forwards to the right
A human is making a counter-clockwise turn. 	 a human is making a counter clockwise turn
a person walks the left performing a quarter circle 	 a person walks the left performing a quarter circle
A person tries to evade something small on the ground and lifts up their feet one after another. 	 a person tries to evade something small on the ground and lifts up their feet 1 after another
a drunk  person walking 	 a drunk person walking
A person is making a sharp turn. 	 a person is making a sharp turn
A person does a few steps forward and hurries a bit 	 a person does a few steps forward and hurries a bit
a person jogs some meters forwards 	 a person jogs some m forwards
A person goes a few steps forward. 	 a person goes a few steps forward
A Person goes four and a half steps forward. 	 a person goes 4 and a half steps forward
A person makes two steps forward, turns around and makes two more steps forward 	 a person makes 2 steps forward turns around and makes 2 more steps forward
A person goes 2 steps forward, then turns around and goes 2 steps forward in the opposite direction. 	 a person goes 2 steps forward then turns around and goes 2 steps forward in the opposite direction
A human walks 2 steps forward, turns on its left foot, walks back and ends up approximately 10 centimeters to the right of the spot where it started. 	 a human walks 2 steps forward turns on its left foot walks back and ends up approximately 10 centimeters to the right of the spot where it started
a person performs a 180 degree turn on one foot 	 a person performs a 180 degrees turn on 1 foot
A person makes a sharp turn to the left while walking 	 a person makes a sharp turn to the left while walking
A person walks a quarter circle counter clockwise with 4 steps. 	 a person walks a quarter circle counter clockwise with 4 steps
A person is taking a left turn while walking 	 a person is taking a left turn while walking
A persond walks a left curve 	 a person walks a left curve
A person walks forwards, slowly turning to the right and stops. 	 a person walks forwards slowly turning to the right and stops
Someone walks a right turn 	 someone walks a right turn
human performs a bending walking movement to the right 	 human performs a bending walking movement to the right
A man is jumping and turns 270 degrees 	 a man is jumping and turns 270 degrees
A person walks forward. 	 a person walks forward
A human goes 4 steps forward at a normal pace. 	 a human goes 4 steps forward at a normal pace
Person walking for a few steps 	 person walking for a few steps
human goes forward slowly starting with right 	 human goes forward slowly starting with right
A human is jumping backwards. 	 a human is jumping backwards
A person jumps backwards with both of his legs. 	 a person jumps backwards with both of his legs
human performs a jump and moves a bit backwards 	 human performs a jump and moves a bit backwards
A person picks something up from the ground and using left leg as a counterbalance. 	 a person picks something up from the ground and using left leg as a counterbalance
A human walks with very large steps. 	 a human walks with very large steps
A human performs a jump kick. 	 a human performs a jump kick
A person is balancing on something. 	 a person is balancing on something
A person walks to the right. 	 a person walks to the right
A person walks forward fast 	 a person walks forward fast
Subject walks forward three steps. 	 subject walks forward 3 steps
A person is showing different heights with his left arm indicating above the head, at shoulder level and at hip level. 	 a person is showing different heights with his left arm indicating above the head at shoulder level and at hip level
Someone moves his arm up then half height and down 	 someone moves his arm up then half height and down
A person reaches for multiple objects. 	 a person reaches for multiple objects
a person points at 3 points with its left hand which are above it besides it and below it 	 a person points at 3 points with its left hand which are above it besides it and below it
A person walking forwards, then turning on the right foot and walking back again. 	 a person walking forwards then turning on the right foot and walking back again
a person walks two steps forwards then turn 180 degrees to the right and walks forward again 	 a person walks 2 steps forwards then turn 180 degrees to the right and walks forward again
Someone uses his hands to touch his throat multiple times. 	 someone uses his hands to touch his throat multiple times
A person walks 4 steps backwards. 	 a person walks 4 steps backwards
human is pushed from right hand side by an invisible force and tries to counterbalance by stepping sideways 	 human is pushed from right hand side by an invisible force and tries to counterbalance by stepping sideways
a person takes a step to the left and then walks sideways back to the origin position 	 a person takes a step to the left and then walks sideways back to the origin position
Somebody avoids to the left 	 somebody avoids to the left
Someone moves forward a brief distance in a fast walk and stops 	 someone moves forward a brief distance in a fast walk and stops
The human perfoms a couple of steps straight forward 	 the human performs a couple of steps straight forward
A person jumps over a hurdle- 	 a person jumps over a hurdle
A person raises both hands to shoulder level, elbows bent then bounces/punches down with his right hand before lowering both hands. 	 a person raises both hands to shoulder level elbows bent then bounces punches down with his right hand before lowering both hands
A person plays the guitar. 	 a person plays the guitar
the person is walking through a  circular path 	 the person is walking through a circular path
A human is walking in circle. 	 a human is walking in circle
A person walks in an S-shape. 	 a person walks in an s shape
A person stoops down and picks up thinks on the ground in a half circle around him 	 a person stoops down and picks up thinks on the ground in a half circle around him
Jump with both feet about 50 centimeters forward 	 jump with both feet about 50 centimeters forward
A Person moves the hands together in front of the chest and kicks with  the left foot. 	 a person moves the hands together in front of the chest and kicks with the left foot
A human is performing a low kick with the left foot, getting the arms up in a defence position 	 a human is performing a low kick with the left foot getting the arms up in a defence position
A person performs a side kick with his hands held close to his body. 	 a person performs a side kick with his hands held close to his body
A person kicks with the left leg. 	 a person kicks with the left leg
someone  is kicking something. 	 someone is kicking something
A person walks around a curve. on his left. 	 a person walks around a curve on his left
A person turns left. 	 a person turns left
A Person is walking a quarter in counter clockwise direction. 	 a person is walking a quarter in counter clockwise direction
a persons walks to the left performing a quarter circle 	 a persons walks to the left performing a quarter circle
A person walks a quarter circle. 	 a person walks a quarter circle
A person does a 90° left turn in five steps 	 a person does a 90 degrees left turn in 5 steps
A person is dancing. 	 a person is dancing
A person walks four steps backward. 	 a person walks 4 steps backward
human goes backwards 	 human goes backwards
A person walks forward 	 a person walks forward
A person walks 4 steps forward. 	 a person walks 4 steps forward
A person walking forwards, turning on the left foot and then walking back again 	 a person walking forwards turning on the left foot and then walking back again
A human walks in a full circle clockwise. 	 a human walks in a full circle clockwise
A person walks in a clockwise circle. 	 a person walks in a clockwise circle
A person walks in a circle clockwise. 	 a person walks in a circle clockwise
A person performs circling motions with both hands. 	 a person performs circling motions with both hands
A person trying to open something. 	 a person trying to open something
A person walks forward 	 a person walks forward
A Person walks in a circle clockwise. 	 a person walks in a circle clockwise
A person walks in a circle to his right side. 	 a person walks in a circle to his right side
A person walks fast 4 steps. 	 a person walks fast 4 steps
Somebody stops suddenly. 	 somebody stops suddenly
A person performs swiping gestures with the left hand. 	 a person performs swiping gestures with the left hand
the person is first walking ahead and then turning to the left 	 the person is first walking ahead and then turning to the left
While running, a human picks something up from the floor. 	 while running a human picks something up from the floor
A person is walking in small circles. 	 a person is walking in small circles
someone walks in a circle counterclockwise three consecutive times. 	 someone walks in a circle counterclockwise 3 consecutive times
a person walks in a circle to the left 3 times 	 a person walks in a circle to the left 3 times
A person doing a one handed flic flac with a full turn. 	 a person doing a 1 handed flic flat with a full turn
a human walks a right circle. 	 a human walks a right circle
A person walks a circle, radius approximatly 1,5 meters. 	 a person walks a circle radius approximately 1,5 meters
a person walks in a cricle to the right 	 a person walks in a circle to the right
A human hikes his shoulders and raises his hands 	 a human hikes his shoulders and raises his hands
A human turning right 	 a human turning right
Someone walks in a counter-clockwise circle. 	 someone walks in a counter clockwise circle
A human walks in a circle with a diameter of 2m. 	 a human walks in a circle with a diameter of 2 m
Someone walk in a full counter-clockwise circle. 	 someone walk in a full counter clockwise circle
A person walks in a full circle. 	 a person walks in a full circle
Someone makes a circle 	 someone makes a circle
He turns around. 	 he turns around
A person walks a circle. 	 a person walks a circle
someone walks one round 	 someone walks 1 round
A person walks a full anti-clockwise circle. 	 a person walks a full anti clockwise circle
A person walks in a circle counterclockwise. 	 a person walks in a circle counterclockwise
a person walks a circle to the left 	 a person walks a circle to the left
The human walks a circle 	 the human walks a circle
A human walks in circle counterclockwise. 	 a human walks in circle counterclockwise
A human turning left 	 a human turning left
A person walks a left curve 	 a person walks a left curve
human performs a bending walking motion to its left hand side 	 human performs a bending walking motion to its left hand side
a person walks 90° of a circle to his right 	 a person walks 90 degrees of a circle to his right
A person walks a quarter circle to the right, taking four steps. 	 a person walks a quarter circle to the right taking 4 steps
A person is turning right while walking 	 a person is turning right while walking
A human stretching is arms 	 a human stretching is arms
A person is balancing on his right foot. 	 a person is balancing on his right foot
a person holds both his arm like wings 	 a person holds both his arm like wings
A person stretching their arms out to the sides 	 a person stretching their arms out to the sides
Lookig at his feet, a human goes circa 1.5 meters forward. 	 looking at his feet a human goes in a circle of 1,5 m forward
A person is walking slowly 	 a person is walking slowly
A person is slowly walking forward. 	 a person is slowly walking forward
A person walks very slowly. 	 a person walks very slowly
Somebody walks slowly. 	 somebody walks slowly
A human turning left 	 a human turning left
A person is tipping forward and start walking before falling over. 	 a person is tipping forward and start walking before falling over
A person is walking forward a few steps. 	 a person is walking forward a few steps
A person walks straight 	 a person walks straight
Person walking forwards 	 person walking forwards
human goes forward slowly starting with left 	 human goes forward slowly starting with left
A human walks forward a few steps looking on the ground 	 a human walks forward a few steps looking on the ground
A person walks forward 	 a person walks forward
A person gets pushed slightly forwards. 	 a person gets pushed slightly forwards
A human is being pushed to the left. 	 a human is being pushed to the left
A human performs different swimming styles with her upper body while standing. 	 a human performs different swimming styles with her upper body while standing
a person walks straight on 	 a person walks straight on
A human runs a 90°leftwards curve while playing basketball. 	 a human runs a 90 degrees leftwards curve while playing basketball
A man is running 	 a man is running
Subject walks forward quickly. 	 subject walks forward quickly
A person walks fast. 	 a person walks fast
A person puts headphones up on his head and listens to music. 	 a person puts headphones up on his head and listens to music
A person is playing violin. 	 a person is playing violin
a person plays the violin with the left hand 	 a person plays the violin with the left hand
A person is walking forward, turns around, walks back and then walks forward in a S-shape. 	 a person is walking forward turns around walks back and then walks forward in a S-shape
A human moves two meters forward. 	 a human moves 2 m forward
a person walks forwards 	 a person walks forwards
a human walks slowly while bonding forward 	 a human walks slowly while bonding forward
During walking, a human is pushed. 	 during walking a human is pushed
Someone is beeing pushed from the back while walking forward. 	 someone is being pushed from the back while walking forward
A person stumbling forward 	 a person stumbling forward
A person performs a sidekick with the right foot. 	 a person performs a sidekick with the right foot
a person kicks something with its right foot 	 a person kicks something with its right foot
A human turns around while jumping in the air. 	 a human turns around while jumping in the air
A person walking a few steps forward 	 a person walking a few steps forward
Person walking forward. 	 person walking forward
Person walking forwards 	 person walking forwards
A person walks forward 	 a person walks forward
a person just walks forward 	 a person just walks forward
a person is evading a boxing punch 	 a person is evading a boxing punch
a person dodges a hit 	 a person dodges a hit
Someone evades a punch. 	 someone evades a punch
A person is backing up as if being boxed 	 a person is backing up as if being boxed
A person dodging down to the right 	 a person dodging down to the right
A person standing in fighting pose with his arms risen to block incoming attacks ducks to dodge an attack. 	 a person standing in fighting pose with his arms risen to block incoming attacks ducks to dodge an attack
Dodging a punch in a box fight by leaning to the right. 	 dodging a punch in a box fight by leaning to the right
A person is waving left hand. 	 a person is waving left hand
a person waves with its left hand 	 a person waves with its left hand
Someone waving with his left hand. 	 someone waving with his left hand
A persons bends the upper body to the left. 	 a persons bends the upper body to the left
Someone in fighting stance is ducking down to the left side. 	 someone in fighting stance is ducking down to the left side
A person sits down on a chair behind him and stands up again. 	 a person sits down on a chair behind him and stands up again
The human is pushed from the right side during walking. 	 the human is pushed from the right side during walking
A person walks as if drunk. 	 a person walks as if drunk
A person is running very fast and slightly to the right. 	 a person is running very fast and slightly to the right
the person makes a short run 	 the person makes a short run
A person jogging for a few meters. 	 a person jogging for a few meters
A person is pushed from right. 	 a person is pushed from right
A person walks 2 steps forward, 2 to the left side and 3 diagonally to the right forward, all the time facing the same direction. 	 a person walks 2 steps forward 2 to the left side and 3 diagonally to the right forward all the time facing the same direction
A human walks forward and is slightly shoved from the right while walking 	 a human walks forward and is slightly shoved from the right while walking
A person walks forward but is pushed to the left and the goes back on track again 	 a person walks forward but is pushed to the left and the goes back on track again
human is pushed from its right hand side while walking 	 human is pushed from its right hand side while walking
A human is running away from something 	 a human is running away from something
A person walks forward. 	 a person walks forward
a person waves 	 a person waves
A person wipes something horizontal 	 a person wipes something horizontal
A human walks four steps backwards 	 a human walks 4 steps backwards
a person taes some steps backwards 	 a person takes some steps backwards
A person walks 5 steps backwards. 	 a person walks 5 steps backwards
a human starts walking backwards 	 a human starts walking backwards
A person stands up from the lying on the ground 	 a person stands up from the lying on the ground
A person walking in a quarter circle to the right. 	 a person walking in a quarter circle to the right
A person is running a few steps forwards. 	 a person is running a few steps forwards
A person walks forward 	 a person walks forward
Someone walks forward 	 someone walks forward
Subject walks in a quarter circle counterclockwise. 	 subject walks in a quarter circle counterclockwise
A human is walking in a left curve, doing a 90° turn 	 a human is walking in a left curve doing a 90 degrees turn
A person walks a quarter circle to the left, taking five steps. 	 a person walks a quarter circle to the left taking 5 steps
A person turns left 	 a person turns left
a human walks a quarter to the left 	 a human walks a quarter to the left
A human turns left in 4 steps 	 a human turns left in 4 steps
A person walks in third of a circle. 	 a person walks in third of a circle
A person is taking a left turn while walking. 	 a person is taking a left turn while walking
a person walks in a quarter circle to the left 	 a person walks in a quarter circle to the left
The human perfoms a left turn 	 the human performs a left turn
A person walks a quarter circle counter clockwise with 4 steps. 	 a person walks a quarter circle counter clockwise with 4 steps
A person walks backwards four steps starting with the left foot. 	 a person walks backwards 4 steps starting with the left foot
Somebody walks backwards. 	 somebody walks backwards
A human walks holding her right upper leg with both hands. 	 a human walks holding her right upper leg with both hands
A person moves forward along 1.5 tiles then turns and moves backwards. 	 a person moves forward along 15 tiles then turns and moves backwards
Someone is walking forward starting with the right leg 2 steps, then turning around his left side facing backwards and doing another 2 steps. 	 someone is walking forward starting with the right leg 2 steps then turning around his left side facing backwards and doing another 2 steps
A Person is walking forward than rotates 180 degree in it's right foot and walks back with a slight shift to the right. 	 a person is walking forward than rotates 180 degrees in it is right foot and walks back with a slight shift to the right
a person walks, picks up an object and inspects it 	 a person walks picks up an object and inspects it
A person walks forwards four steps. 	 a person walks forwards 4 steps
a person walks straight forward 	 a person walks straight forward
A human walks slowly 4 steps on one line. 	 a human walks slowly 4 steps on 1 line
A human is walking a few steps 	 a human is walking a few steps
A human performs a 180° counter clockwise jump. 	 a human performs a 180 degrees counter clockwise jump
a person walks 90° of a circle 	 a person walks 90 degrees of a circle
A person walks in a quater circle to the right taking 4 steps and starting with the right foot. 	 a person walks in a quarter circle to the right taking 4 steps and starting with the right foot
a person walks to the right performing a quarter circle 	 a person walks to the right performing a quarter circle
A person walks forward and is pushed gently to the left 	 a person walks forward and is pushed gently to the left
A person walks forward avoiding an obstacle on the floor by stepping around it. 	 a person walks forward avoiding an obstacle on the floor by stepping around it
A person appears to begin walking in a circle. 	 a person appears to begin walking in a circle
human goes in a quater circle counterclockwise starting with left 	 human goes in a quarter circle counterclockwise starting with left
Walking in a quarter circle to the left. 	 walking in a quarter circle to the left
A person walks forwards and stops without moving their arms. 	 a person walks forwards and stops without moving their arms
Someone walks forward 	 someone walks forward
A person walks forward without being in a hurry. 	 a person walks forward without being in a hurry
A person is walking forward. 	 a person is walking forward
A person walking slowly forwards, then turning on the left foot and walking back again. 	 a person walking slowly forwards then turning on the left foot and walking back again
A human is walks 2 steps, turns on its left food and walks back to the same spot where it started. 	 a human is walks 2 steps turns on its left food and walks back to the same spot where it started
some one walks straight and turn around in a sudden and then walks back. 	 some 1 walks straight and turn around in a sudden and then walks back
A person walks two steps forwards, then turns around by 180° to the left and walks two steps. 	 a person walks 2 steps forwards then turns around by 180 degrees to the left and walks 2 steps
A person walks forward and performs a turn to the right. 	 a person walks forward and performs a turn to the right
A person walks in a quarter-circle to the right. 	 a person walks in a quarter circle to the right
A person walks towards me. 	 a person walks towards me
Someone comes close to the camera 	 someone comes close to the camera
A person is walking in a curve to the right. 	 a person is walking in a curve to the right
Someone comes very close to the observer. 	 someone comes very close to the observer
A human takes a 90 degree right turn. 	 a human takes a 90 degrees right turn
a person walking five steps to the right 	 a person walking 5 steps to the right
A person walks slowly a curve 	 a person walks slowly a curve
A person walks in a 90 degree turn towards the right 	 a person walks in a 90 degrees turn towards the right
A human slowly turns right by 5 steps 	 a human slowly turns right by 5 steps
A person walks  a quarter circle with a radius of approximately 1 meter to the right. 	 a person walks a quarter circle with a radius of approximately 1 m to the right
A human is performing a 90° curve to the right 	 a human is performing a 90 degrees curve to the right
A person is walking a quarter of a circle to its right. 	 a person is walking a quarter of a circle to its right
a person walks to the right performing a quarter circle 	 a person walks to the right performing a quarter circle
A person walks forward in a 90° curve to his right. 	 a person walks forward in a 90 degrees curve to his right
The human perfoms a right turn 	 the human performs a right turn
A person is doing slow a 90° right turn in five steps 	 a person is doing slow a 90 degrees right turn in 5 steps
