human goes in a quater circle counterclockwise starting with left 	 human goes in a quarter circle counterclockwise starting with left
a human goes backwards while bending forward 	 a human goes backwards while bending forward
A person runs to the forward direction. 	 a person runs to the forward direction
a person gets shoved from the back 	 a person gets shoved from the back
a human makes one step forward, as if he was pushed in the back. 	 a human makes 1 step forward as if he was pushed in the back
A person performs the basic step of the Cha-Cha-Cha ballroom dance. 	 a person performs the basic step of the cha cha cha ballroom dance
the person looks like playing a violin 	 the person looks like playing a violin
A person plays a violin while he holds it with his right arm and plays it with his left arm. 	 a person plays a violin while he holds it with his right arm and plays it with his left arm
A left-handed person plays the violin. 	 a left handed person plays the violin
A persond steps one step to the left side. 	 a person steps 1 step to the left side
a person takes a step to the left 	 a person takes a step to the left
A person is taking one step to the left. 	 a person is taking 1 step to the left
A person does a quick sidestep to the left. 	 a person does a quick sidestep to the left
A person is waving to someone with his right hand. 	 a person is waving to someone with his right hand
A person gets an arrow out of their quiver on the back, draws a bow and shoots. 	 a person gets an arrow out of their quiver on the back draws a bow and shoots
A person standing still and doing a wiping movement with the left hand. 	 a person standing still and doing a wiping movement with the left hand
a person wipes something in front of it with its left hand 	 a person wipes something in front of it with its left hand
A person is pushed back while walking straight 	 a person is pushed back while walking straight
Subject walks forward is pushed back and then walks forward again. 	 subject walks forward is pushed back and then walks forward again
a person walks forwards but gets pushed from the front stumbles backwards and keeps on walking 	 a person walks forwards but gets pushed from the front stumbles backwards and keeps on walking
A person turns left. 	 a person turns left
A person walks a left turn of 90 degrees while looking down. 	 a person walks a left turn of 90 degrees while looking down
A person is turning right. 	 a person is turning right
A subject being pushed 	 a subject being pushed
A person is pushed away and  tumbles backwards. 	 a person is pushed away and tumbles backwards
a person gets pushed backwards 	 a person gets pushed backwards
A person walks in a quarter circle. 	 a person walks in a quarter circle
A person is fighting against something or someone. 	 a person is fighting against something or someone
A person is shuffling forward, making a jump into the air and continues shuffling forward. 	 a person is shuffling forward making a jump into the air and continues shuffling forward
A person briefly raises both hands and moves them back down. 	 a person briefly raises both hands and moves them back down
A person is making a jump forward with both feet. 	 a person is making a jump forward with both feet
Someone moves forward in a walk and then tumbles to the right side as if pushed, but then walks balk to the original trajectory. 	 someone moves forward in a walk and then tumbles to the right side as if pushed but then walks balk to the original trajectory
A person walks forward and gets shoved from his left before he stumbles very hard and goes back to his track in the end. 	 a person walks forward and gets shoved from his left before he stumbles very hard and goes back to his track in the end
A person gets shoved from the left and returns to their path. 	 a person gets shoved from the left and returns to their path
A person steers a car with occasional gear shifts. 	 a person steers a car with occasional gear shifts
A human performs a 270° counter clockwise jump. 	 a human performs a 270 degrees counter clockwise jump
Person walking in a curve to the left 	 person walking in a curve to the left
human goes in a quater circle counterclockwise starting with left 	 human goes in a quarter circle counterclockwise starting with left
A person who is flapping their arms up and down walks one revolution counter-clockwise and then takes 3 small steps forward. 	 a person who is flapping their arms up and down walks 1 revolution counter clockwise and then takes 3 small steps forward
A person walks forward, during that the person is pushed to the left. 	 a person walks forward during that the person is pushed to the left
a person walks forwards and then gets pushed to the left 	 a person walks forwards and then gets pushed to the left
a person dodges. 	 a person dodges
A person is pushed to the right and recovering. 	 a person is pushed to the right and recovering
A person makes an compensatory movement to his right side. 	 a person makes an compensatory movement to his right side
A person walks and avoids an obstacle to his left. 	 a person walks and avoids an obstacle to his left
A person is doing a somersault forward. 	 a person is doing a somersault forward
A human strokes a pet on his chest. 	 a human strokes a pet on his chest
A person is slowly and casually walking forward with swinging arms. 	 a person is slowly and casually walking forward with swinging arms
A person walks counter clockwise in a circle. 	 a person walks counter clockwise in a circle
A person climbs stairs. 	 a person climbs stairs
a human is climbing some stairs. 	 a human is climbing some stairs
A person walks a quarter circle clockwise with 4 steps. 	 a person walks a quarter circle clockwise with 4 steps
Someone walks a right circle. 	 someone walks a right circle
A person performs a circular movement. 	 a person performs a circular movement
Walking in a circle to the right. 	 walking in a circle to the right
A person is holding his hands forward and punching like he is boxing. 	 a person is holding his hands forward and punching like he is boxing
A human walking backwards. 	 a human walking backwards
A human performs a boxing punch. 	 a human performs a boxing punch
Someone is sprinting through the room. 	 someone is sprinting through the room
a person runs straight forward 	 a person runs straight forward
a man is running 	 a man is running
a person walks a few steps 	 a person walks a few steps
a person walks forwards quite easy 	 a person walks forwards quite easy
A human walking in a circle clockwise 	 a human walking in a circle clockwise
A person walks a full circle to the right. 	 a person walks a full circle to the right
A person walks slowly 4 steps forward. 	 a person walks slowly 4 steps forward
A person walks straight forward a few meters 	 a person walks straight forward a few meters
A human starts to play violin 	 a human starts to play violin
human plays the violin 	 human plays the violin
The human is playing a violin 	 the human is playing a violin
Somebody sands something 	 somebody sands something
the person is walking in a circular shape 	 the person is walking in a circular shape
Person walks a circle. 	 person walks a circle
A person picks up an object with the left hand, passes it to the right hand and puts it back down. 	 a person picks up an object with the left hand passes it to the right hand and puts it back down
a person walks slowly 	 a person walks slowly
Person dancing the waltz 	 person dancing the waltz
someone is dancing the basic step of the waltz 	 someone is dancing the basic step of the waltz
A person dances the waltz 	 a person dances the waltz
A person dancing the foxtrot. 	 a person dancing the foxtrot
A person dancing 	 a person dancing
A persons turns 90° to the left. 	 a persons turns 90 degrees to the left
A person walks a quarter left sides circle. 	 a person walks a quarter left sides circle
A person turns left. 	 a person turns left
A human is playing golf. 	 a human is playing golf
A person walks 4 big steps to the forward direction. 	 a person walks 4 big steps to the forward direction
a person walks forwards quite fast 	 a person walks forwards quite fast
A person stands and is then pushed from behind 	 a person stands and is then pushed from behind
A subject is pushed from the back while standing. 	 a subject is pushed from the back while standing
A human is being pushed and performs a sidestep to the front 	 a human is being pushed and performs a sidestep to the front
A person walking in a circle to the left 	 a person walking in a circle to the left
A human pushed from the side 	 a human pushed from the side
A human gets puched from its right side and makes a step to the left. 	 a human gets pushed from its right side and makes a step to the left
A person stumbles to the left 	 a person stumbles to the left
human goes in a quater circle clockwise starting with right 	 human goes in a quarter circle clockwise starting with right
A person walks forwards. 	 a person walks forwards
A person is moving slowly forward while holding his injured leg with hands. 	 a person is moving slowly forward while holding his injured leg with hands
A person starts a circular movement towards the left. 	 a person starts a circular movement towards the left
human slowly goes in a quater circle counterclockwise starting with right 	 human slowly goes in a quarter circle counterclockwise starting with right
A Person moves in a slow walk around a corner to the left 	 a person moves in a slow walk around a corner to the left
A person walks forward, during that the person is pushed back, than walks on. 	 a person walks forward during that the person is pushed back than walks on
A person with initially bent knees stands up and reaches forward with the left arm. 	 a person with initially bent knees stands up and reaches forward with the left arm
a person performs a turn around. 	 a person performs a turn around
A person walks forward for 2 steps then turns 180° to his right and walks forward for 2 more steps. 	 a person walks forward for 2 steps then turns 180 degrees to his right and walks forward for 2 more steps
The human walks a couple of steps turn around and walks back to starting point 	 the human walks a couple of steps turn around and walks back to starting point
Someone walks forwards quickly 	 someone walks forwards quickly
a person walks forwards 	 a person walks forwards
The human perfoms a couple of steps 	 the human performs a couple of steps
Somebody walks straight on. 	 somebody walks straight on
A human writes on a board. 	 a human writes on a board
A person walks forward while being pushed to the left 	 a person walks forward while being pushed to the left
Someone walks forward and get pushed from the right 	 someone walks forward and get pushed from the right
A person walking forwards 3 steps, then takes a sidestep to his left before walking back to the target of his original track. 	 a person walking forwards 3 steps then takes a sidestep to his left before walking back to the target of his original track
The human walk perfoms a left jump and walks again 	 the human walk performs a left jump and walks again
Somebody is pushed to the left. 	 somebody is pushed to the left
A person walks backwards. 	 a person walks backwards
a person walks in a circle counterclockwise 	 a person walks in a circle counterclockwise
The human walks a circle 	 the human walks a circle
Subject walks in a full circle counterclockwise. 	 subject walks in a full circle counterclockwise
The human walks a circle 	 the human walks a circle
A man move laterally 	 a man move laterally
A person stumbling to the left 	 a person stumbling to the left
A person takes a few recovery steps to the left. 	 a person takes a few recovery steps to the left
A person steps to his left. 	 a person steps to his left
A person is pushed from the right to the left. 	 a person is pushed from the right to the left
A person stumbling to the left 	 a person stumbling to the left
A person jumps to the left. 	 a person jumps to the left
The human perfoms a jump to the left 	 the human performs a jump to the left
A person plays the air guitar. 	 a person plays the air guitar
The human plays air guitar. 	 the human plays air guitar
Person playing air guitar 	 person playing air guitar
A person performs a drumming motion with their left hand while holding up their right hand 	 a person performs a drumming motion with their left hand while holding up their right hand
a person is doing something 	 a person is doing something
A person performs two strokes on a guitar. 	 a person performs 2 strokes on a guitar
Person makes motions as if it is half hearted playing guitar. 	 person makes motions as if it is half hearted playing guitar
a person walks forward 	 a person walks forward
a person walks forwards quite slow 	 a person walks forwards quite slow
A person walks 4 steps forward. 	 a person walks 4 steps forward
A person walks straight forwards, turns around and then walks back. 	 a person walks straight forwards turns around and then walks back
the person is waving the right hand 	 the person is waving the right hand
A person waves with its right hand. 	 a person waves with its right hand
A person waves with his right arm. 	 a person waves with his right arm
A person touches the floor with their right hand and kneels down. 	 a person touches the floor with their right hand and kneels down
A human starts to run. 	 a human starts to run
A person stands and waves with their right hand. 	 a person stands and waves with their right hand
A person waves his hand. 	 a person waves his hand
A person turns 180° to the left quickly. 	 a person turns 180 degrees to the left quickly
A human is making a 180 degrees turn. 	 a human is making a 180 degrees turn
a person walks forwards a few steps and then turns 180 degrees to the right and walks back a few meters again 	 a person walks forwards a few steps and then turns 180 degrees to the right and walks back a few m again
A human walking slowly 	 a human walking slowly
A person performs seven rather slow forward steps. 	 a person performs 7 rather slow forward steps
A person walks forward 	 a person walks forward
A human walks into an obstacle. 	 a human walks into an obstacle
A human walks forward a few steps and is then shoved back from somebody in front of him 	 a human walks forward a few steps and is then shoved back from somebody in front of him
A person hits an obstacle while moving forward. 	 a person hits an obstacle while moving forward
A person is walking with large steps. 	 a person is walking with large steps
A person walks forward in a hurry 	 a person walks forward in a hurry
Someone is walking forward 4 steps a bit faster and is starting with the right leg. 	 someone is walking forward 4 steps a bit faster and is starting with the right leg
A person walks fast. 	 a person walks fast
The human is running 	 the human is running
A person is walking fast 	 a person is walking fast
A person walks a circle clock-wise. 	 a person walks a circle clock wise
A person walks in clock-wise circle. 	 a person walks in clock wise circle
A human is walking in a circle to the right. 	 a human is walking in a circle to the right
A person walks forward, during that the person is pushed to the left and gains balance again. 	 a person walks forward during that the person is pushed to the left and gains balance again
Someone is beeing pushed from the left side, while walking forward. 	 someone is being pushed from the left side while walking forward
A human sprints three steps forward 	 a human sprints 3 steps forward
A person is pushed during walking 	 a person is pushed during walking
A person walks three steps forward, then one step back and another two steps forward. 	 a person walks 3 steps forward then 1 step back and another 2 steps forward
The human walks a couple of steps. Perfoms a step backwards and walks forward again 	 the human walks a couple of steps performs a step backwards and walks forward again
A person gets pushed from left to right. 	 a person gets pushed from left to right
A person receives a strong push from the left side and tumbles to the left. 	 a person receives a strong push from the left side and tumbles to the left
A person takes a few sidewared steps to the right to recover from a push. 	 a person takes a few sidewards steps to the right to recover from a push
a person stands still and gets pushed to the right 	 a person stands still and gets pushed to the right
A person gets shoved from his left, he stumbles to his right before standing still again. 	 a person gets shoved from his left he stumbles to his right before standing still again
A person walks in a circle. 	 a person walks in a circle
A human performs a jump to the left. 	 a human performs a jump to the left
A person cleans a surface by making circular motions with their left hand. 	 a person cleans a surface by making circular motions with their left hand
A human wipes on a table. 	 a human wipes on a table
A person stirs with their left hand 	 a person stirs with their left hand
A person sitting on his knees is standing up by using both of his hands. 	 a person sitting on his knees is standing up by using both of his hands
A person walks a quarter circle clockwise with 4 steps. 	 a person walks a quarter circle clockwise with 4 steps
A person walks forward in a fast fashion. 	 a person walks forward in a fast fashion
A human makes 4 fast steps forward. 	 a human makes 4 fast steps forward
A human turning right 	 a human turning right
a person walks forward 	 a person walks forward
Person standing and then stumbling forwards 	 person standing and then stumbling forwards
Someone gets pushed from behind 	 someone gets pushed from behind
a person stands still and gets pushed from behind 	 a person stands still and gets pushed from behind
A person gets shoved 	 a person gets shoved
A human subject is waving five times with the right hand. 	 a human subject is waving 5 times with the right hand
a person waves with his right hand 	 a person waves with his right hand
a person walks backwards 	 a person walks backwards
a person walks backward 	 a person walks backward
A person walks backwards 	 a person walks backwards
human goes backwards 	 human goes backwards
A person stops and then runs to the left. 	 a person stops and then runs to the left
the person is walking forward 	 the person is walking forward
A person performs a 180° turn to the right. 	 a person performs a 180 degrees turn to the right
A person turns 180degree to the right on their left foot 	 a person turns 180 degrees to the right on their left foot
Someone walks forward 	 someone walks forward
A human walks a few steps forward. 	 a human walks a few steps forward
A person walks forward at medium speed. 	 a person walks forward at medium speed
human slowly goes forward 	 human slowly goes forward
A person uses his right hand to pick something up from the ground. 	 a person uses his right hand to pick something up from the ground
A person is pushed from behind while walking forward. 	 a person is pushed from behind while walking forward
A person is walking forwards. 	 a person is walking forwards
A person repeatedly picks something up from the floor and holds the object high above. 	 a person repeatedly picks something up from the floor and holds the object high above
Subject walks forward. 	 subject walks forward
A person starts walking 4 steps forward and then stops. 	 a person starts walking 4 steps forward and then stops
A person walks forward and returns. 	 a person walks forward and returns
A person walks two steps, turns around to the right and walks another two steps 	 a person walks 2 steps turns around to the right and walks another 2 steps
A person walks in a clockwise circle. 	 a person walks in a clockwise circle
A person walks in a clockwise circle. 	 a person walks in a clockwise circle
A Person walking in a Circle. 	 a person walking in a circle
A person turns to his right . 	 a person turns to his right
someone is walking one round to his side 	 someone is walking 1 round to his side
A person is walking to the left by making a circle shape 	 a person is walking to the left by making a circle shape
A person goes around in a circuit 	 a person goes around in a circuit
a person walks in a circle to the right 	 a person walks in a circle to the right
Somebody walks a circle clockwise. 	 somebody walks a circle clockwise
Subject running fast. 	 subject running fast
A person runs a few meters forward 	 a person runs a few m forward
A person running forward. 	 a person running forward
A person runs. 	 a person runs
someone is running. 	 someone is running
a human is running 	 a human is running
A human stretches and performs a squad. 	 a human stretches and performs a squad
A person is drinking something out of a bottle by using his right hand. 	 a person is drinking something out of a bottle by using his right hand
A human running 	 a human running
A person is dancing. 	 a person is dancing
A person walks straight forward, then turns around 180 degrees and walks back again. 	 a person walks straight forward then turns around 180 degrees and walks back again
Person waving with the left arm 	 person waving with the left arm
Someone waves with the left hand 	 someone waves with the left hand
a person waves with its left hand 	 a person waves with its left hand
A human waves with his left hand. 	 a human waves with his left hand
a person walks forward 	 a person walks forward
A person turns 90° to the left with medium speed. 	 a person turns 90 degrees to the left with medium speed
A person is turning left while walking. 	 a person is turning left while walking
A person steps 5 steps to the forward direction after being pushed from behind. 	 a person steps 5 steps to the forward direction after being pushed from behind
A person does 4 steps forwars fast. 	 a person does 4 steps forward fast
a person walks fast forwards 	 a person walks fast forwards
A person makes one big step an one small step backwards. 	 a person makes 1 big step an 1 small step backwards
A human is pushed from the front 	 a human is pushed from the front
a person stands still and gets pushed backwards 	 a person stands still and gets pushed backwards
A person gets pushed from right and recovers with 1 step. 	 a person gets pushed from right and recovers with 1 step
A human imitates a chicken and performs a picking movement. 	 a human imitates a chicken and performs a picking movement
A person walks a quarter circle clockwise with 4 steps. 	 a person walks a quarter circle clockwise with 4 steps
A human walks backwards. 	 a human walks backwards
the person is first showing two hands and then kneeling down with the support of two hands 	 the person is first showing 2 hands and then kneeling down with the support of 2 hands
Someone is kneeling down. 	 someone is kneeling down
A human walks and takes a 90° turn. 	 a human walks and takes a 90 degrees turn
A person plays air guitar. 	 a person plays air guitar
a person plays the air guitar 	 a person plays the air guitar
a person holds something in its left hand and touches it along with its right hand 	 a person holds something in its left hand and touches it along with its right hand
A person waves both hands. 	 a person waves both hands
A persons waves with both hands. 	 a persons waves with both hands
A human is waving with both hands mirrored before its head 	 a human is waving with both hands mirrored before its head
A person is waving at someone/something with both hands. 	 a person is waving at someone something with both hands
a person waves with both hands 	 a person waves with both hands
A person waves with both of his arms. 	 a person waves with both of his arms
A person is walking forward, slipping and falling on his back. 	 a person is walking forward slipping and falling on his back
Someone waves with their right hand. 	 someone waves with their right hand
Person waving with the right hand 	 person waving with the right hand
Someone rises his right arm and waves with it 	 someone rises his right arm and waves with it
A person waves for 5 times using the right hand. 	 a person waves for 5 times using the right hand
A human is waving with its right hand. 	 a human is waving with its right hand
a person walks a few steps forward, turns around and walks back 	 a person walks a few steps forward turns around and walks back
A person interacts with something using the right hand and first and then using both hands later. 	 a person interacts with something using the right hand and first and then using both hands later
A person holds a violin with the right hand and strokes it with the left hand. 	 a person holds a violin with the right hand and strokes it with the left hand
a person plays the violin with its left arm 	 a person plays the violin with its left arm
A person stands still. 	 a person stands still
A person is pushed to the left. 	 a person is pushed to the left
A person walking forwards for a few steps.. 	 a person walking forwards for a few steps
A person walks straight forward a few meters 	 a person walks straight forward a few meters
A person walks in a clockwise circle. 	 a person walks in a clockwise circle
A person walks in a little circle. 	 a person walks in a little circle
A person walks forward in a circle clockwise. 	 a person walks forward in a circle clockwise
Someone walks forward 	 someone walks forward
A person runs forward then getting slower. 	 a person runs forward then getting slower
A person joggs a jew steps, then it stops. 	 a person jogs a jew steps then it stops
A person is walking in a hurry 	 a person is walking in a hurry
the person is  walking ahead 	 the person is walking ahead
a person walks forwards 	 a person walks forwards
